"name","ID","link","recommend","liked","disliked","experience","comment"
"Смартфон OPPO A16 3/32GB Crystal Black","289d0eb200da972f7b8aa3316884ce99","https://hotline.ua/ua/mobile-mobilnye-telefony-i-smartfony/oppo-a16-332gb-crystal-black/","рекомендує цей товар","Батарея,экран","Отсутствие NFC","кілька днів","Купи пару дней назад,телефон нужен был для работы и интернета,чтоб хорошо держала батарея,выбрал эту модель и.к давно пользуюсь техникой Oppo.Классный дизайн выглядит дороже чем его стоимость .из минусов отсутствие NFC хотя в 2022 модуль необходим,хорошо держит батарею"
"Смартфон OPPO Reno5 Lite 8/128GB Fluid Black","5015a843df7030d96e2e444181441452","https://hotline.ua/ua/mobile-mobilnye-telefony-i-smartfony/oppo-reno5-lite-8128gb-fluid-black/","рекомендує цей товар","Шумодав экрана, звук ок, качество связи, музыки. Автономность, и качество фото","Проц. Тип памяти вроде 2.1","кілька місяців","В общем телефон сойдёт кто не требовательный к процу и стандарту внутренней памяти. В остальное ок. Правда цена завышена."
"Смартфон OPPO A54 4/128GB Crystal Blue","683a045372c88c95a3fd162dc36ba986","https://hotline.ua/ua/mobile-mobilnye-telefony-i-smartfony/oppo-a54-4128gb-crystal-blue/","рекомендує цей товар","Аккумулятор, экран, стабильность работы","Хотелось бы отпечаток под экраном","кілька годин","Стоимость не высокая. Хорошо исполненный, эргономичный, тонкий, в руке лежит как родной.. ) С большим дисплеем, разрешение высокое. Есть NFC, ночной режим съёмки. Оболочка приятная, сама себе какая то, другая, но на андройде. По плавности отлично."
"Смартфон OPPO A53 4/64GB Black","e730464707bf8693e266f96789fa67d8","https://hotline.ua/ua/mobile-mobilnye-telefony-i-smartfony/oppo-a53-464gb-black/","рекомендує цей товар","Дизайн, камера","","кілька тижнів","Пользуюсь почти месяц, все супер, нравится как батарея держит, и как фоткает камера, по своей цене отлично все!"
"Смартфон OPPO Reno5 Lite 8/128GB Fantastic Purple","299bc4f1c29d6755458cee1fe37e933d","https://hotline.ua/ua/mobile-mobilnye-telefony-i-smartfony/oppo-reno5-lite-8128gb-fantastic-purple/","рекомендує цей товар","Добротный, легкий, качественный телефон, хорошая отзывчивость при взаимодействии с пользователем, достаточно оперативной памяти, для параллельно работающих программ. Не плохое качество видео съемки. По сравнению с другими телефонами, хорошо держит заряд аккумулятора, общая работа экрана 4-6 часов: от 100% до 25-30% заряда - в среднем 3,5 суток(). Не плохая ночная съемка, автомат лучше работает, чем мой старый цифровой фотоаппарат. В комплекте уже наклеенна пленка на экран и есть силиконовый чехол","Прошивка для Украины лишена возможности установить программу для записи разговоров с абонентом, так же почему-то программу для прослушивания эфирного радио, но аппаратно, вроде как, радио присутствует. Фото от штатной программы сильно шарпит(другую не пробовал), при 100% размере, на мониторе объекты сливаются в пятна, как при эффектах фотошопа, но на экране современного телевизора фото в целом выглядит вполне достойно. Подавляющее большинство гугловских программ не отключаются, кроме как сторонней программой по USB кабелю. Модель телефона пока-что лишена возможности установить рут права. Дешевый, жесткий штатный кабель для зарядки, но это уже придирка, ну и штатные наушники по звучанию вообще никакие","кілька місяців","Есть поддержка от производителя, сразу после покупки пришло обновление. Множество настроек одной тематики нелогично разбросанные в разных разделах меню настройки телефона. Экран не мерцает даже при низкой яркости, а у меня чувствительные глаза. Дополнительные 5 Гб сразу отключил за ненужностью, телефон и так быстро работает. При не мощном, по сегодняшним меркам процессоре, аппарат хорошо оптимизирован, торможений и задержек за время пользования не замечал, в играх телефон не проверял. Отсутствие 90 Герц - для меня, скорее плюс, так как экран меньше использует батарею."
"Смартфон OPPO Reno5 Lite 8/128GB Fantastic Purple","299bc4f1c29d6755458cee1fe37e933d","https://hotline.ua/ua/mobile-mobilnye-telefony-i-smartfony/oppo-reno5-lite-8128gb-fantastic-purple/","рекомендує цей товар","Цікавий дизайн, хороша камера, гарний вибір відносно ціни і якості","Телефоном користуюсь кілька днів, поки що все подобається","кілька днів",""
"Смартфон OPPO A74 4/128GB Midnight Blue","ba6b8fd55a36830c485e98e24d0a59a5","https://hotline.ua/ua/mobile-mobilnye-telefony-i-smartfony/oppo-a74-4128gb-midnight-blue/","рекомендує цей товар","RAM+, камера, комплектация, цена","","кілька місяців","Вот добрался спустя пол года использования смартфона чтобы написать коментарий). Очень порадовала камера(в отпуске с женой сделали кучу отличных фотографий при этом качество как на зеркалке). Хоть и думал что процессор будет слабоват (Snapdragon 662), но у ребёнка работает всё стабильно. Играет в геншин. Есть одна класная фича RAM+ с 4гб оперативной памяти можно расширить до 7 гб. В целом мне для работы этого хватает. порадовала комплектация (Поклеена плёнка, чехол(спустя пол года как новый и не выцвел), кабель питания, блок питания и наушники(жаль только что проводные)). Яркий амолед дисплей не засвечивает на солнце."
"Смартфон OPPO A53 4/64GB Fancy Blue","5399863cd348d17eec6132f1c8a32bfd","https://hotline.ua/ua/mobile-mobilnye-telefony-i-smartfony/oppo-a53-464gb-fancy-blue/","рекомендує цей товар","Акумулятор,ергономіка,стерео","Не знайшов мінусів","кілька тижнів","Купив по знижці,дякую продавцям,що порекомендували.Акумулятор тримає дійсно дві доби при середньому користуванні,стерео дуже круте,зручно що є все в комплекті.Ще з великих плюсів це його прошивка,головне стабільна.Рекомендую!"
"Смартфон OPPO A53 4/128GB Fancy Blue","33bec01db5c76048b5e1c31ea7af2b93","https://hotline.ua/ua/mobile-mobilnye-telefony-i-smartfony/oppo-a53-4128gb-fancy-blue/","рекомендує цей товар","Сподобалось","Нет","кілька місяців","Работает хорошо"
"Смартфон OPPO A53 4/64GB Black","e730464707bf8693e266f96789fa67d8","https://hotline.ua/ua/mobile-mobilnye-telefony-i-smartfony/oppo-a53-464gb-black/","рекомендує цей товар","Камера, звук, швидкість роботи, дизайн","Все супер","кілька місяців","Телефон просто супер, брав на подарок, але покористувавшись взяв собі тільки вже іншу модель. Звук якісний та голосний. За ті гроші кращого мабуть нема."
"Смартфон OPPO A53 4/64GB Black","e730464707bf8693e266f96789fa67d8","https://hotline.ua/ua/mobile-mobilnye-telefony-i-smartfony/oppo-a53-464gb-black/","рекомендує цей товар","Абсолютно усе","Все ідеально","кілька тижнів","Шикарний телефон із дуже крутим стерео звучанням.
Дисплей яскравий, тому дивитися відео - одне задоволення.
Взагалі усе сподобалося, я рекомендую!"
"Смартфон OPPO Reno5 Lite 8/128GB Fluid Black","5015a843df7030d96e2e444181441452","https://hotline.ua/ua/mobile-mobilnye-telefony-i-smartfony/oppo-reno5-lite-8128gb-fluid-black/","рекомендує цей товар","Купил 2 месяца назад,не каких проблем нету,быстро работает,хорошая батарея,есть дополнительно 5 гигабайт оперативной памяти","Все понравилось","кілька місяців",""
"Смартфон OPPO A54 4/64GB Crystal Black","db5cbb3ee6dfe86ec493b3ae25c5ec74","https://hotline.ua/ua/mobile-mobilnye-telefony-i-smartfony/oppo-a54-464gb-crystal-black/","рекомендує цей товар","Автономність, фронтальна камера, дисплей","","кілька тижнів","Працює чудово. Заряд тримає в моєму режимі 2 дні. Чудово ловить зв'язок, інтернет швидко завантажується. Дисплей має хорошу яскравість. Рекомендую."
"Смартфон OPPO A54 4/64GB Starry Blue","e503a60d70c8fb57faf06a2c05ce83b0","https://hotline.ua/ua/mobile-mobilnye-telefony-i-smartfony/oppo-a54-464gb-starry-blue/","рекомендує цей товар","Камера","Нет","кілька тижнів","Камера фоткает отлично. Фронталка вообще шик 16 мегапикселей чувствуется. На моем старом и то фронтальная камера была тусклее.Мощный аккумулятор. Яркий экран . Звук громкий. Нет назойливой рекламы."
"Смартфон OPPO A74 4/128GB Prism Black","b7150b034f768dd8cd7b8bb458d16ec5","https://hotline.ua/ua/mobile-mobilnye-telefony-i-smartfony/oppo-a74-4128gb-prism-black/","рекомендує цей товар","Камера, скорость работы, время автономной работы","Все круто","кілька тижнів","Пользуюсь уже несколько недель, максимально доволен. Всегда хватает батареи при довольно активном пользовании(по работе). Крутой экран, яркий. Большим плюсом для меня была возможность добавить оперативной памяти в настройках, раньше вечно выгружало приложения. Для работы то что нужно"
"Смартфон OPPO A54 4/64GB Starry Blue","e503a60d70c8fb57faf06a2c05ce83b0","https://hotline.ua/ua/mobile-mobilnye-telefony-i-smartfony/oppo-a54-464gb-starry-blue/","рекомендує цей товар","экран и батарея","маркий корпус","кілька місяців","Камера фоткает отлично. Фронталка вообще шик 16 мегапикселей чувствуется. На моем старом redmi и то фронтальная камера была тусклее.Мощный аккумулятор. Яркий экран . Звук громкий. Нет назойливой рекламы."
"Смартфон OPPO A74 4/128GB Midnight Blue","ba6b8fd55a36830c485e98e24d0a59a5","https://hotline.ua/ua/mobile-mobilnye-telefony-i-smartfony/oppo-a74-4128gb-midnight-blue/","не рекомендує цей товар","камера ничего так, батарея и зарядка отличные","процессор допотопный 662 снапдрагон, который даже на слабых играх лагает, очень плохо работает датчик отпечатка пальцев, датчик приближения к уху никогда не работает нормально","кілька тижнів","Честно сказать разочарован смартом, цена завышена как для такой сборки железа. Короче есть куча вариантов что взять кроме него)) скажем так Xiomi редми 6 работает намного лучше, хотя этому телефону уже 4 года."
"Смартфон OPPO A91 8/128GB Black","8379b338eecf4e4090e3055f168a24c0","https://hotline.ua/ua/mobile-mobilnye-telefony-i-smartfony/oppo-a91-8128gb-black/","рекомендує цей товар","Экран, эргономика телефона","Непонятные лаги на момент покупки","рік і більше","В общем тел норма. Камера средняя по качеству и по работе. По началу лаги были обновил систему всё ок стало. В общем идеальная сбалансированная рабочая лошадка. Экран норма глаза не устают. Заряд держит ок. Качество связи ок."
"Смартфон OPPO A54 4/64GB Starry Blue","e503a60d70c8fb57faf06a2c05ce83b0","https://hotline.ua/ua/mobile-mobilnye-telefony-i-smartfony/oppo-a54-464gb-starry-blue/","рекомендує цей товар","Процесор, аккумулятор, звук, камера, дисплей, связь супер","не медиатек","кілька місяців","Прям влюбился в этот смартфон. Красивый и умный во всём. Грани приятно лежат в руке, яркий дисплей, и камера с хорошей цветопередачей. Технология добавления оперативки выручает."
"Смартфон OPPO A53 4/64GB Fancy Blue","5399863cd348d17eec6132f1c8a32bfd","https://hotline.ua/ua/mobile-mobilnye-telefony-i-smartfony/oppo-a53-464gb-fancy-blue/","рекомендує цей товар","Гарний смартфон. Надзвичайно швидко реагує. Батарея супер. Динаміки дуже голосні. Мені сподобався. Рекомендую","Поки нічого немає","кілька днів",""
"Смартфон OPPO A74 4/128GB Midnight Blue","ba6b8fd55a36830c485e98e24d0a59a5","https://hotline.ua/ua/mobile-mobilnye-telefony-i-smartfony/oppo-a74-4128gb-midnight-blue/","рекомендує цей товар","батарея, экран, память","не хватает ширика","кілька місяців","Брал жене. Сам пользуюсь второй год reno 2. В целом жена довольна, экран яркий, долго держит батарею, много памяти, не виснет и порадовал не гибридный, а полноценнный лоток сим. Иногда не хватает широкоугольного модуля, но поскольку пользуемся им не часто, можно пережить его отсутствие. В общем рекомендую!"
"Смартфон OPPO A54 4/64GB Starry Blue","e503a60d70c8fb57faf06a2c05ce83b0","https://hotline.ua/ua/mobile-mobilnye-telefony-i-smartfony/oppo-a54-464gb-starry-blue/","рекомендує цей товар","Звук, Скорость работы, Хорошая связь","Камера выступает","кілька тижнів","Сразу ощущается добротным смартфоном, сборка порадовала ничего не скрипит, по первым дням пользования могу сказать что сделал правильный выбор! Камера и звук крутые, батарея держит долго. добавили быструю зарядку, в целом очень сбалансированный.
Самое важное в руке удобный сейчас это редкость!"
"Смартфон OPPO A53 4/64GB Black","e730464707bf8693e266f96789fa67d8","https://hotline.ua/ua/mobile-mobilnye-telefony-i-smartfony/oppo-a53-464gb-black/","не рекомендує цей товар","Дизайн, екран, автономність, ColorOS","Швидкодія системи, процесор, компромісна камера","кілька тижнів","Перший досвід використання ОРРО.

Потрібен був телефон бюджетного сегменту але я потрапив в цікавий проміжок часу коли нічого цікавого не було на ринку, а ціни почали рости.

У телефона приємний дизайн (це плюс) але при цьому він збирає всі відбитки і пил як тільки ти відкриваєш коробку (це мінус).
Екран досить приємний, зауважень до нього у мене нема.
Камера компромісна але для того щоб щось сфотографувати на пам'ять або відправити фото родичам - нормально.

Найбільше засмутила швидкодія системи. При не поганій оболонці ColorOS телефон в повсякденній роботі може підгальмовувати. За таку приємність дякуємо Snapdragon 460.

У підсумку цей телефон можна рекомендувати якщо потрібно взяти бюджетну модель дітям або старшому поколінню без зазіхань на ігрову приставку. І лише за умови якщо цей телефон коштує до 5 тисяч, а ще краще до 4,500 грн.

В іншому випадку, саме цю модель ОРРО не рекомендую до придбання."
"Смартфон OPPO A52 4/64GB Twilight Black","4e79cc5b92362a099b0911980f449c94","https://hotline.ua/ua/mobile-mobilnye-telefony-i-smartfony/oppo-a52-464gb-twilight-black/","рекомендує цей товар","Сканер лица, батарея держит 2 суток при обычном использовании, камера на твердую 4 , скорость телефона 5, заряжается телефон очень быстро. приятное звучание звука. качество изображения на высоте","отпечаток пальца на кнопке - прикольно, но не очень удобно..меню непривычное (на главном экране большую часть занимают часы и всего 8 доп значков)...габариты, искал телефон поменьше","кілька днів","Для меня - телефон отличный, хорошее соотношение цена-качество."
"Смартфон OPPO A12 3/32GB Black","78273d7a8a8dd3b18980f72daad2e57e","https://hotline.ua/ua/mobile-mobilnye-telefony-i-smartfony/oppo-a12-332gb-black/","рекомендує цей товар","Автономність, екран, фірмова оболонка, комплектація","За таку ціну не варто придиратись до чогось","кілька місяців","В цій ціновій категорії смартфон дуже хороший, може легко протриматись 2 дні якщо використовувати по потребам базовим, непоганий екран з хорошою контрастністю і яскравістю, дуже зручна оболонка фірмова, багато зручних фішок, телефон працює доволі швидко. В комплекті є силіконовий чохол. Камера для такого сегменту досить непогана, можна покращити якість вбудованими налаштуваннями, селфі камера теж цілком непогана. Можна пограти в нескладні ігри. Для невибагливих користувачі - чудовий вибір."
"Смартфон OPPO A73 4/128GB Navy Blue","65d02832e342b2e07a1b9ad9869e0a8f","https://hotline.ua/ua/mobile-mobilnye-telefony-i-smartfony/oppo-a73-4128gb-navy-blue/","рекомендує цей товар","Шикарний дизайн і крута зарядка","Все супер","кілька тижнів","Користуюсь 2 тижні все круто. Приємно здивувала швидкість зарядки 1 година. Швидкий і стильний . Рекомендую"
"Смартфон OPPO Find X2 Pro 12/512GB Black","7b4d28c977a23eb7263462a6ae7199b8","https://hotline.ua/ua/mobile-mobilnye-telefony-i-smartfony/oppo-find-x2-pro-12512gb-black/","рекомендує цей товар","Користуюсь вже від липня 2020-го! .Політ нормальний!.Чудова альтернатива с21 ультра та новому Ванпласу 9 про!.Х3 Про не раджу, бо в камерах стався даунгрейд","Ультраширик так і не підтягнули для рівня флагмана в нічному режимі!.але якшо в тебе прямі руки - то все ок","кілька місяців","Все вищеописане в подобаннях!"
"Смартфон OPPO A15 2/32GB Dynamic Black","7b0929ce48acc760380f0d11ac399d7c","https://hotline.ua/ua/mobile-mobilnye-telefony-i-smartfony/oppo-a15-232gb-dynamic-black/","рекомендує цей товар","Відмінна якість камери","Не виявлено","кілька місяців","Відмінна якість камери, дуже швидко заряджається. Плавний в роботі, як ненагружав працює відмінно!"
"Смартфон OPPO A91 8/128GB Black","8379b338eecf4e4090e3055f168a24c0","https://hotline.ua/ua/mobile-mobilnye-telefony-i-smartfony/oppo-a91-8128gb-black/","рекомендує цей товар","Камера, зручний, компактний","Не знайшла недоліки","кілька днів","Чудовий смартфон, сподобався своєю компактністю та швидкістю роботи. Для мене не менш важлива камера в смартфоні, тут вона чудова, навіть ввечері я отримала гарні знімки. Батарейку тримає день при моєму дуже активному використанні."
