"name","ID","link","recommend","liked","disliked","experience","comment"
"Смартфон OPPO Reno3 Pro 12/256GB Midnight Black","909c45619c562db9a2355f7d1855cdb3","https://hotline.ua/ua/mobile-mobilnye-telefony-i-smartfony/oppo-reno3-pro-12256gb-midnight-black/","рекомендує цей товар","камера (не флагман 2020, але на ціна/якість дуже добре); дизайн; ергономіка (добре лежить в руці); 256гб і 12гб озу; швидка зарядка","чохол в незрозумілу пупиришку і збирає сильно бруд в середині, навіть якщо до нього торакатись; хотілось би трошки кращу автономність; чомусь в оригіналі на кришкі присутні написи про мейд-ін та про утилізацію","кілька тижнів","в ігри не граю, тому 765g мені більш ніж достатньо та і в іграх він ніби має себе добре показувати. ПО стабільне і не було жодного глюка чи лага, але інтуітивно незрозумілі налаштування і не наскільки гнучке в плані налаштувань як miUI. Загалом, якщо брати те, що купив за поперднім замовленням за 15к, дуже задоволений телефоном."
"Смартфон OPPO Reno3 8/128GB Auroral Blue","f987c5e0116a11b46c6997c19aa99fac","https://hotline.ua/ua/mobile-mobilnye-telefony-i-smartfony/oppo-reno3-8128gb-auroral-blue/","рекомендує цей товар","Камера, дизайн , очень удобный в руке, наушники в подарок","Все понравилось","кілька годин","Выбирал между samsung a 71 и Рино 3 , Рино оказался лучше по камере, памяти , стабилизации, + ко всему наушники за 2 к в подарок"
"Смартфон OPPO Reno3 Pro 12/256GB Midnight Black","909c45619c562db9a2355f7d1855cdb3","https://hotline.ua/ua/mobile-mobilnye-telefony-i-smartfony/oppo-reno3-pro-12256gb-midnight-black/","не рекомендує цей товар","Качественное исполнение Изогнутый экран Стерео звук","Цена Чипсет","кілька днів","Oppo китайщина в тридорога, которая очень хочет выглядеть флагманом в непонятно каком сегменте. Смартфон на среднем чипсете. Ему цена 12 тыс. грн. макс. За эти деньги лучше взять Samsung S10 на Snapdragon 855, он намного быстрее, имеет влагозащиту, беспроводную зарядку, разъем 3.5 мм, камеры получше и солидный бренд."
"Смартфон OPPO A9 2020 4/128GB Marine Green","c0e3824258307bb08142c9b8a9ea79ce","https://hotline.ua/ua/mobile-mobilnye-telefony-i-smartfony/oppo-a9-2020-4128gb-marine-green/","рекомендує цей товар","Автономность, камера, стерео звук, процессор","не обнаружил","кілька тижнів","Пользуюсь смартфоном чуть больше месяца. Нареканий нет. Порадовал АКБ на 5000mAh (живёт 2 дня), мощный процессор (работает шустро без тормозов). Удивила камера, не думал что за 7тыс грн будет хорошо снимать. У знакомых xiaomi note 8 pro и samsung A50, сравнивали по камерам так Oppo обоих обогнал по детализации и цветопередачи. Если с samsung не большая разница по фото то xiaomi сильно уступает (тестили и обычное фото и отдельно 64МП), в очередной раз убедился что количество пикселей в камере ничего не решает. Приятный объёмный стерео звук, громкий и не трещит на высокой громкости.
Приятный бонус, чехол в комплекте - плотный силиконовый и борты выступают за корпус! Кому нужен автономный и при этом современный смартфон советую"
"Смартфон OPPO Reno Z 4/128GB Aurora Purple","58550c64c35e712aa5595e89f68f74f1","https://hotline.ua/ua/mobile-mobilnye-telefony-i-smartfony/oppo-reno-z-4128gb-aurora-purple/","рекомендує цей товар","Красивый дизайн,расцветка корпуса оригинальная.Комплектация","Нет тёмной темы,возможно в следующей прошивке будет.Не совсем понятно с версией,глобальная или нет.Регион только Россия.Украины нет.Язык только русский.Возможно добавят в дальнейшем","кілька тижнів","Очень хороший смартфон,аккумулятор держит долго.Экран отличный,яркий.Камера очень достойная,снимки отличного качества,особенно в ночном режиме.Комплектация просто супер.Отличный бампер,плёнка заводская хорошая,наушники играют очень даже неплохо.Звук динамиков тоже хороший,стерео.К покупке рекомендую!"
"Смартфон OPPO Reno2 Z 8/128GB Sky White","22f838a51ba05caad1b53da3d3e96de1","https://hotline.ua/ua/mobile-mobilnye-telefony-i-smartfony/oppo-reno2-z-8128gb-sky-white/","рекомендує цей товар","Тонкие рамки экрана, отсутствие челки, хорошая оптика","Недостатков не обнаружила","кілька тижнів","Работает круто. У него хороший экран,отлично держит батарею, шикарный дизайн, встроенный в экран сканер отпечатков пальцев. 4 камеры сзади, даже ночные съемка на 10 баллов!"
